path,title,headings,topic_number,category,file_type,date_sensitive,modified_date
00-知识刷新/inventory/2026-05-25-inventory.md,知识清单 - 2026-05-25,# 知识清单 - 2026-05-25,00,知识刷新,正式主题笔记,是,2026-05-25
00-知识刷新/inventory/2026-05-26-inventory.md,知识清单 - 2026-05-26,# 知识清单 - 2026-05-26,00,知识刷新,正式主题笔记,是,2026-05-26
00-知识刷新/reports/2026-05-25-refresh.md,跨境电商知识库刷新报告 - 2026-05-25,# 跨境电商知识库刷新报告 - 2026-05-25 | ## 基本信息 | ## 扫描结果 | ## 本轮新增 | ## 本轮更新 | ## 缺失主题 | ## 过时风险 | ## 来源依据,00,知识刷新,正式主题笔记,是,2026-05-25
00-知识刷新/reports/2026-05-26-refresh-2.md,跨境电商知识库刷新报告 - 2026-05-26 第二轮,# 跨境电商知识库刷新报告 - 2026-05-26 第二轮 | ## 基本信息 | ## 扫描结果 | ## 本轮新增 | ## 本轮更新 | ## 缺失主题 | ## 过时风险 | ## 来源依据,00,知识刷新,正式主题笔记,是,2026-05-26
00-知识刷新/reports/2026-05-26-refresh.md,跨境电商知识库刷新报告 - 2026-05-26,# 跨境电商知识库刷新报告 - 2026-05-26 | ## 基本信息 | ## 扫描结果 | ## 本轮新增 | ## 本轮更新 | ## 缺失主题 | ## 过时风险 | ## 来源依据,00,知识刷新,正式主题笔记,是,2026-05-26
00-知识刷新/主题地图.md,跨境电商知识库主题地图,# 跨境电商知识库主题地图 | ## 覆盖原则 | ## 核心主题 | ## 时效性主题,00,知识刷新,正式主题笔记,是,2026-05-26
00-知识刷新/报告模板.md,跨境电商知识库刷新报告模板,# 跨境电商知识库刷新报告模板 | ## 基本信息 | ## 扫描结果 | ## 本轮新增 | ## 本轮更新 | ## 缺失主题 | ## 过时风险 | ## 延后处理,00,知识刷新,正式主题笔记,否,2026-05-26
00-知识刷新/运行手册.md,跨境电商知识库刷新运行手册,# 跨境电商知识库刷新运行手册 | ## 执行频率 | ## 固定流程 | ## 完成标准,00,知识刷新,正式主题笔记,是,2026-05-26
01-基础概念/跨境电商基础概念.md,跨境电商基础概念,# 跨境电商基础概念 | ## 什么是跨境电商？ | ## 三种主要模式 | ## 跨境电商 vs 国内电商（核心区别） | ## 主要市场 | ## 主流平台 | ## 新手入门建议,01,基础概念,正式主题笔记,是,2026-04-20
02-平台运营/Amazon平台基础.md,Amazon 平台基础,# Amazon 平台基础 | ## Amazon 卖家账号体系 | ### 两类账号 | ### 两种销售方式 | ## FBA 完整流程 | ## Amazon 核心指标（卖家必须懂） | ## 新手常见误区 | ## 开店基本要求（中国卖家）,02,平台运营,正式主题笔记,是,2026-04-20
02-平台运营/Amazon选品方法.md,Amazon 选品方法与工具,# Amazon 选品方法与工具 | ## 选品的重要性 | ## 选品核心原则 | ### 1. 轻小、易发货 | ### 2. 竞争适中 | ### 3. 有利润空间 | ### 4. 不侵权 | ### 5. 刚需品 > 改善品,02,平台运营,正式主题笔记,是,2026-04-20
02-平台运营/TikTok Shop运营.md,TikTok Shop 运营,# TikTok Shop 运营 | ## 核心要点 | ## 相关文件,02,平台运营,正式主题笔记,是,2026-04-20
02-平台运营/平台规则与账号体系.md,平台规则与账号体系,# 平台规则与账号体系 | ## Amazon 账号关联与风控 | ## 账号类型详解 | ## 类目审核（Category Approval） | ## 平台规则红线 | ## 其他平台账号体系 | ### Shopify | ### eBay,02,平台运营,正式主题笔记,是,2026-04-20
02-平台运营/独立站Shopify.md,独立站建站与推广（Shopify）,# 独立站建站与推广（Shopify） | ## 独立站 vs 平台 | ## Shopify 建站核心步骤 | ## Shopify 必备插件 | ## 独立站流量体系 | ## Google 广告 | ## Facebook/Instagram 广告 | ## TikTok 电商,02,平台运营,正式主题笔记,是,2026-04-20
02-平台运营/速卖通运营策略.md,速卖通 AliExpress 运营策略,# 速卖通 AliExpress 运营策略 | ## 核心要点 | ### 平台定位 | ### 入驻要求 | ### 物流方案 | ### 运营核心 | ### 收款 | ### 与亚马逊对比,02,平台运营,正式主题笔记,是,2026-04-20
03-供应链管理/供应链管理.md,供应链管理,# 供应链管理 | ## 供应链核心链路 | ## 供应商开发渠道 | ## 供应商筛选标准 | ## 产品成本拆解 | ## 头程物流成本计算 | ## 库存管理 | ## 质检流程,03,供应链管理,正式主题笔记,是,2026-04-20
04-物流仓储/国际物流.md,国际物流全解,# 国际物流全解 | ## 物流方式对比 | ## FBA 详细费用结构 | ## FBA 优缺点 | ## 海外仓 | ## 跨境小包物流 | ## 清关基础知识 | ## 物流保险,04,物流仓储,正式主题笔记,是,2026-04-20
05-支付系统/主流支付方式对比.md,主流支付方式对比,# 主流支付方式对比 | ## 选型结论 | ## 主要支付服务商 | ### Stripe | ### PayPal | ### Adyen | ### Airwallex | ## 对比维度,05,支付系统,正式主题笔记,是,2026-05-25
05-支付系统/拒付与Chargeback处理.md,拒付与 Chargeback 处理,# 拒付与 Chargeback 处理 | ## 核心判断 | ## 拒付的基本流程 | ## 常见原因 | ## 证据链清单 | ### 实物商品 | ### 虚拟商品或服务 | ## 处理 SOP,05,支付系统,正式主题笔记,是,2026-05-26
05-支付系统/支付系统.md,支付系统,# 支付系统 | ## 跨境支付全链路 | ## 主流收款工具 | ## 信用卡通道 | ## 结汇方式 | ## 支付安全与防欺诈 | ## 各国本地支付,05,支付系统,正式主题笔记,是,2026-05-26
06-各国税务/各国税制.md,各国税务基础,# 各国税务基础 | ## 欧洲 VAT（Value Added Tax） | ## 美国 Tax（销售税） | ## 日本 消费税（JCT） | ## 东南亚 GST | ## 各国税务申报要求 | ## 税务合规建议,06,各国税务,正式主题笔记,是,2026-04-20
06-税务法务/欧洲VAT详解.md,欧洲 VAT 详解,# 欧洲 VAT 详解 | ## 一句话理解 | ## 关键概念 | ## 欧盟 VAT 电商规则 | ### 1. 欧盟境内 B2C 远程销售 | ### 2. 从中国等非欧盟国家直发欧盟消费者 | ### 3. 通过平台销售 | ## 英国 VAT 与欧盟不同,06,税务法务,正式主题笔记,是,2026-05-26
06-税务法务/税务合规.md,跨境电商税务合规,# 跨境电商税务合规 | ## 税务合规是跨境电商的生死线 | ## 一、增值税（VAT / GST） | ### 1.1 什么是 VAT？ | ### 1.2 主要市场 VAT 税率 | ### 1.3 OSS（One-Stop-Shop）一站式申报 | ### 1.4 英国 VAT 独立系统 | ### 1.5 GST（消费税）— 澳大利亚 & 日本 & 东南亚,06,税务法务,正式主题笔记,是,2026-05-26
07-社媒营销/社媒营销.md,社媒营销全解,# 社媒营销全解 | ## 各平台特点 | ## 内容策略 | ## 红人营销（KOL/KOC） | ## 邮件营销（EDM） | ## 私域流量运营,07,社媒营销,正式主题笔记,是,2026-04-20
08-实战避坑/避坑清单.md,实战避坑清单,# 实战避坑清单 | ## 账号运营避坑 | ## 物流避坑 | ## 税务避坑 | ## 财务避坑 | ## 选品避坑 | ## 广告避坑,08,实战避坑,正式主题笔记,是,2026-04-20
100-FBA物流配送与派送优化/notes.md,主题 100：亚马逊FBA物流配送与派送优化,# 主题 100：亚马逊FBA物流配送与派送优化 | ## 学习目标 | ## 核心知识点 | ### 1. FBA配送机制 | ### 2. 配送时效优化策略 | ### 3. 多渠道配送（MCF） | ### 4. 最后一公里优化 | ## 学习内容摘要,100,FBA物流配送与派送优化,正式主题笔记,是,2026-04-27
103-亚马逊日本站运营攻略/notes.md,亚马逊日本站运营全攻略,# 亚马逊日本站运营全攻略 | ## 学习内容摘要 | ### 一、日本站市场特点 | ### 二、开店与账号注册 | ### 三、Listing优化要点 | ### 四、FBA配送 | ### 五、定价策略 | ### 六、营销与推广,103,亚马逊日本站运营攻略,正式主题笔记,是,2026-04-27
105-亚马逊中东站运营攻略/notes.md,亚马逊中东站运营攻略,# 亚马逊中东站运营攻略 | ## 主题信息 | ## 一、市场概况 | ### 1.1 亚马逊中东站规模 | ### 1.2 热销品类 | ## 二、注册与入驻 | ### 2.1 入驻要求 | ### 2.2 特殊要求,105,亚马逊中东站运营攻略,正式主题笔记,是,2026-04-27
109-亚马逊选品工具与数据分析/README.md,亚马逊选品工具与数据分析,# 亚马逊选品工具与数据分析 | ## 核心概念 | ## 主要选品工具 | ### 1. Helium 10 | ### 2. Jungle Scout | ### 3. 卖家精灵 | ### 4. AMZ123 | ### 5. Keepa,109,亚马逊选品工具与数据分析,正式主题笔记,是,2026-04-27
112-亚马逊A9排名算法深度解析/notes.md,亚马逊A9排名算法深度解析,# 亚马逊A9排名算法深度解析 | ## 一、A9算法是什么？ | ## 二、A9算法的核心排名因素 | ### 1. 转化率因素 (Conversion Rate) | ### 2. 相关性因素 (Relevance) | ### 3. 客户满意度 (Customer Satisfaction) | ### 4. 库存和配送因素 | ## 三、A9算法的演变 - 从A9到A10,112,亚马逊A9排名算法深度解析,正式主题笔记,是,2026-04-27
114-亚马逊选品之竞品分析法/notes.md,亚马逊选品之竞品分析法,# 亚马逊选品之竞品分析法 | ## 核心概念 | ## 主要分析维度 | ### 1. 竞争对手识别 | ### 2. 销量估算 | ### 3. 定价分析 | ### 4. 评价分析 | ### 5. 市场容量评估,114,亚马逊选品之竞品分析法,正式主题笔记,是,2026-04-27
117-亚马逊选品之竞争对手分析实战/content.md,117-亚马逊选品之竞争对手分析实战,# 117-亚马逊选品之竞争对手分析实战 | ## 竞争对手分析框架 | ### 一、找到核心竞品 | ### 二、基础数据分析 | ### 三、流量结构拆解 | ### 四、盈利空间测算 | ### 五、差异化定位策略 | ### 六、竞品监控工具,117,亚马逊选品之竞争对手分析实战,正式主题笔记,是,2026-04-28
120-亚马逊选品之供应链管理与成本控制/notes.md,亚马逊选品之供应链管理与成本控制,# 亚马逊选品之供应链管理与成本控制 | ## 学习时间 | ## 学习内容摘要 | ### 1. 供应链管理核心要素 | ### 2. 成本控制关键点 | ### 3. 供应链风险管理 | ## 学习判断 | ## 关键要点,120,亚马逊选品之供应链管理与成本控制,正式主题笔记,是,2026-04-28
121-亚马逊选品之产品合规与认证要求/README.md,121-亚马逊选品之产品合规与认证要求,# 121-亚马逊选品之产品合规与认证要求 | ## 学习内容摘要 | ### 1. 常见认证类型 | ### 2. 目标市场合规要求 | ### 3. 产品标签要求 | ### 4. 禁限售商品 | ### 5. 知识产权风险 | ## 对不对的判断：✓ 正确,121,亚马逊选品之产品合规与认证要求,正式主题笔记,是,2026-04-28
122-亚马逊选品之专利排查与侵权规避/content.md,亚马逊选品之专利排查与侵权规避,# 亚马逊选品之专利排查与侵权规避 | ## 主题概述 | ## 核心知识点 | ### 1. 专利类型 | ### 2. 专利排查渠道 | ### 3. 排查关键步骤 | ### 4. 侵权风险类型 | ### 5. 规避策略,122,亚马逊选品之专利排查与侵权规避,正式主题笔记,是,2026-04-28
123-亚马逊选品之爆款复制与横向扩展策略/learn.md,123-亚马逊选品之爆款复制与横向扩展策略,# 123-亚马逊选品之爆款复制与横向扩展策略 | ## 学习内容摘要 | ### 什么是爆款复制策略？ | ### 核心方法 | ### 关键步骤 | ### 风险控制 | ## 学习判断 | ## 是否新知识,123,亚马逊选品之爆款复制与横向扩展策略,正式主题笔记,是,2026-04-28
126-亚马逊选品AI工具与智能需求预测/notes.md,126-亚马逊选品AI工具与智能需求预测,# 126-亚马逊选品AI工具与智能需求预测 | ## 学习内容 | ### 一、AI选品工具概述 | ### 二、主流AI选品工具 | ### 三、智能需求预测 | ### 四、AI选品实战应用 | ## 学习反思 | ## 总结,126,亚马逊选品AI工具与智能需求预测,正式主题笔记,是,2026-04-28
129-亚马逊品牌分析之品牌报告与品牌健康度/学习记录.md,亚马逊品牌分析之品牌报告与品牌健康度,# 亚马逊品牌分析之品牌报告与品牌健康度 | ## 1. 主题概述 | ## 2. 核心知识点 | ### 2.1 Brand Report（品牌报告） | ### 2.2 Brand Health（品牌健康度） | ### 2.3 数据来源与差异 | ## 3. 判断正确性与准确性 | ## 4. 是否为新知识,129,亚马逊品牌分析之品牌报告与品牌健康度,正式主题笔记,是,2026-04-28
135-亚马逊广告投放自动化与智能优化系统/notes.md,135-亚马逊广告投放自动化与智能优化系统,# 135-亚马逊广告投放自动化与智能优化系统 | ## 学习主题 | ## 学习时间 | ## 学习内容摘要 | ### 一、亚马逊广告自动化的核心价值 | ### 二、主流自动化工具类型 | ### 三、智能优化系统架构 | ### 四、关键自动化策略,135,亚马逊广告投放自动化与智能优化系统,正式主题笔记,是,2026-04-28
141-亚马逊广告效果评估与报表分析/学习笔记.md,亚马逊广告效果评估与报表分析,# 亚马逊广告效果评估与报表分析 | ## 一、学习内容摘要 | ### 1. 核心广告效果指标 | ### 2. 广告报表类型 | ### 3. 数据分析维度 | ## 二、知识验证 | ## 三、知识属性 | ## 四、实战应用建议,141,亚马逊广告效果评估与报表分析,正式主题笔记,是,2026-04-28
148-亚马逊退货管理逆向物流与退货率优化/content.md,亚马逊退货管理逆向物流与退货率优化,# 亚马逊退货管理逆向物流与退货率优化 | ## 主题说明 | ## 一、退货原因分析 | ### 1.1 核心退货原因分布 | ### 1.2 关键洞察 | ## 二、退货率对账号的影响 | ### 2.1 直接指标影响 | ### 2.2 隐性成本,148,亚马逊退货管理逆向物流与退货率优化,正式主题笔记,是,2026-04-28
151-亚马逊库存预测与补货策略深度解析/笔记.md,亚马逊库存预测与补货策略深度解析,# 亚马逊库存预测与补货策略深度解析 | ## 章节一：库存预测基础概念 | ## 章节二：预测方法与模型 | ### 1. 基础预测法 | ### 2. 高级预测工具 | ## 章节三：补货策略实操 | ### 补货公式 | ### 补货频率策略,151,亚马逊库存预测与补货策略深度解析,正式主题笔记,是,2026-04-28
160-亚马逊库存周转率深度优化策略/notes.md,亚马逊库存周转率深度优化策略,# 亚马逊库存周转率深度优化策略 | ## 学习摘要 | ### 一、库存周转率核心概念 | ### 二、影响周转率的关键因素 | ### 三、库存周转率优化策略 | ### 四、库存健康度指标监控 | ### 五、实战技巧 | ### 六、周转率与利润的关系,160,亚马逊库存周转率深度优化策略,正式主题笔记,是,2026-04-28
163-亚马逊选品之产品开发流程.md,163-亚马逊选品之产品开发流程,# 163-亚马逊选品之产品开发流程 | ## 学习内容摘要 | ### 一、产品开发核心流程（6步） | ### 二、产品开发关键指标 | ### 三、常见错误 | ## 学习评估 | ## 标签,163,亚马逊选品之产品开发流程.md,正式主题笔记,是,2026-04-28
167-亚马逊选品之产品测试与迭代优化.md,167-亚马逊选品之产品测试与迭代优化,# 167-亚马逊选品之产品测试与迭代优化 | ## 学习内容 | ### 什么是产品测试与迭代优化？ | ### 核心内容 | ### 对不对的判断 | ### 是不是新知识 | ### 是否好理解 | ## 评价,167,亚马逊选品之产品测试与迭代优化.md,正式主题笔记,是,2026-04-28
168-亚马逊爆款生命周期与风险管理/notes.md,168-亚马逊爆款生命周期与风险管理,# 168-亚马逊爆款生命周期与风险管理 | ## 学习摘要 | ### 一、爆款生命周期的四个阶段 | ### 二、爆款生命周期管理策略 | ### 三、爆款核心风险管理 | ### 四、数据监控指标 | ## 学习评估,168,亚马逊爆款生命周期与风险管理,正式主题笔记,是,2026-04-28
175-亚马逊卖家数据分析仪表板深度解析/notes.md,亚马逊卖家数据分析仪表板深度解析,# 亚马逊卖家数据分析仪表板深度解析 | ## 学习内容摘要 | ### 1. 业务报告仪表板 (Business Reports) | ### 2. 品牌分析仪表板 (Brand Analytics) | ### 3. 仪表板核心指标解读 | ### 4. 数据可视化技巧 | ### 5. 高级分析工具 | ## 判断（正确/有误）,175,亚马逊卖家数据分析仪表板深度解析,正式主题笔记,是,2026-04-28
176-亚马逊品牌旗舰店运营与品牌建设.md,176-亚马逊品牌旗舰店运营与品牌建设,# 176-亚马逊品牌旗舰店运营与品牌建设 | ## 学习时间 | ## 学习内容摘要 | ### 品牌旗舰店定义 | ### 核心功能 | ### 品牌旗舰店优势 | ### 创建要求 | ## 判断,176,亚马逊品牌旗舰店运营与品牌建设.md,正式主题笔记,是,2026-04-28
179-亚马逊店铺绩效复盘与改进策略.md,179-亚马逊店铺绩效复盘与改进策略,# 179-亚马逊店铺绩效复盘与改进策略 | ## 学习时间 | ## 学习内容摘要 | ### 店铺绩效复盘概述 | ### 核心指标维度 | ### 复盘周期 | ### 复盘流程 | ### 改进策略方向,179,亚马逊店铺绩效复盘与改进策略.md,正式主题笔记,是,2026-04-28
207-亚马逊选品之供应链金融与账期管理策略.md,207-亚马逊选品之供应链金融与账期管理策略,# 207-亚马逊选品之供应链金融与账期管理策略 | ## 学习时间 | ## 学习内容摘要 | ## 学习判断 | ## 是否新知识 | ## 理解难度,207,亚马逊选品之供应链金融与账期管理策略.md,正式主题笔记,否,2026-04-28
208-亚马逊选品之爆款复制与规模化扩展策略.md,208-亚马逊选品之爆款复制与规模化扩展策略,# 208-亚马逊选品之爆款复制与规模化扩展策略 | ## 学习摘要 | ### 核心概念 | ### 关键策略 | ### 实施步骤 | ### 是否正确：正确 | ### 是否新知识：是 | ### 是否好理解：好理解,208,亚马逊选品之爆款复制与规模化扩展策略.md,正式主题笔记,否,2026-04-28
216-亚马逊跨境电商数据分析与商业智能系统/notes.md,亚马逊跨境电商数据分析与商业智能系统,# 亚马逊跨境电商数据分析与商业智能系统 | ## 什么是商业智能系统 | ## 核心组成部分 | ### 1. 数据源层 | ### 2. 数据仓库 | ### 3. 数据分析层 | ### 4. 可视化与报表 | ## 常用的BI工具,216,亚马逊跨境电商数据分析与商业智能系统,正式主题笔记,是,2026-04-28
235-亚马逊选品之广告AI智能化投放与预算优化系统/笔记.md,235 - 亚马逊选品之广告AI智能化投放与预算优化系统,# 235 - 亚马逊选品之广告AI智能化投放与预算优化系统 | ## 学习内容摘要 | ### 核心概念 | ### 正确性判断：✓ 基本正确 | ### 是否新知识：★ ★ ★ ☆ ☆ （3/5） | ### 理解难度：★ ★ ★ ☆ ☆ （3/5） | ## 相关主题,235,亚马逊选品之广告AI智能化投放与预算优化系统,正式主题笔记,是,2026-04-28
255-亚马逊多店铺矩阵运营与品牌协同进阶策略.md,255 - 亚马逊多店铺矩阵运营与品牌协同进阶策略,# 255 - 亚马逊多店铺矩阵运营与品牌协同进阶策略 | ## 学习摘要 | ## 知识判断 | ## 学习日期 | ## 知识点标签,255,亚马逊多店铺矩阵运营与品牌协同进阶策略.md,正式主题笔记,否,2026-04-29
276-亚马逊跨境电商全渠道品牌生态构建与增长战略.md,亚马逊跨境电商全渠道品牌生态构建与增长战略,# 亚马逊跨境电商全渠道品牌生态构建与增长战略 | ## 学习内容 | ### 1. 全渠道品牌生态的核心概念 | ### 2. 品牌生态的四个支柱 | ### 3. 增长战略框架 | ### 4. 关键成功要素 | ## 学习内容摘要 | ## 判断,276,亚马逊跨境电商全渠道品牌生态构建与增长战略.md,正式主题笔记,是,2026-04-29
281-亚马逊跨境电商供应链金融与资金流转优化策略.md,281-亚马逊跨境电商供应链金融与资金流转优化策略,# 281-亚马逊跨境电商供应链金融与资金流转优化策略 | ## 学习内容摘要 | ### 1. 供应链金融核心概念 | ### 2. 亚马逊供应链金融工具 | ### 3. 资金流转优化策略 | ### 4. 跨境资金流转合规要求 | ## 学到了吗？ | ## 是不是新知识？,281,亚马逊跨境电商供应链金融与资金流转优化策略.md,正式主题笔记,是,2026-04-29
287-亚马逊跨境电商生态系统协同与平台价值共创策略.md,287 - 亚马逊跨境电商生态系统协同与平台价值共创策略,# 287 - 亚马逊跨境电商生态系统协同与平台价值共创策略 | ## 学习摘要 | ## 知识判断 | ## 学习日期 | ## 知识点标签,287,亚马逊跨境电商生态系统协同与平台价值共创策略.md,正式主题笔记,是,2026-04-29
293-亚马逊跨境电商企业可持续发展战略.md,293 - 亚马逊跨境电商企业可持续发展战略,# 293 - 亚马逊跨境电商企业可持续发展战略 | ## 核心内容 | ### 1. 可持续发展理念 | ### 2. 可持续发展实践 | ### 3. 社会责任 | ### 4. 治理与合规 | ### 5. 可持续竞争优势,293,亚马逊跨境电商企业可持续发展战略.md,正式主题笔记,是,2026-04-29
321-跨境电商智能化运营与AI驱动业务增长策略.md,321 - 跨境电商智能化运营与AI驱动业务增长策略,# 321 - 跨境电商智能化运营与AI驱动业务增长策略 | ## 学习日期 | ## 学习内容摘要 | ### 1. AI在跨境电商中的应用场景 | ### 2. 数据驱动的精细化运营 | ### 3. 业务增长策略 | ### 4. 智能化转型路径 | ## 对不对的判断：✓ 正确,321,跨境电商智能化运营与AI驱动业务增长策略.md,正式主题笔记,是,2026-04-29
382-跨境电商独立站网红营销与KOL合作策略.md,382-跨境电商独立站网红营销与KOL合作策略,# 382-跨境电商独立站网红营销与KOL合作策略 | ## 核心概念 | ### 网红类型分层 | ## 核心策略 | ### 1. 找对网红 | ### 2. 合作形式 | ### 3. 效果衡量 | ## 跨境电商独立站应用,382,跨境电商独立站网红营销与KOL合作策略.md,正式主题笔记,是,2026-05-04
397-跨境电商独立站社交媒体整合与社交电商策略.md,跨境电商独立站社交媒体整合与社交电商策略,# 跨境电商独立站社交媒体整合与社交电商策略 | ## 学习内容摘要 | ## 学习判定,397,跨境电商独立站社交媒体整合与社交电商策略.md,正式主题笔记,是,2026-05-04
398-跨境电商独立站全渠道营销整合与OMNICHANNEL策略.md,跨境电商独立站全渠道营销整合与OMNICHANNEL策略,# 跨境电商独立站全渠道营销整合与OMNICHANNEL策略 | ## 学习内容摘要 | ## 学习判定,398,跨境电商独立站全渠道营销整合与OMNICHANNEL策略.md,正式主题笔记,否,2026-05-04
403-跨境电商独立站国际化扩张策略与全球市场进入.md,403 - 跨境电商独立站国际化扩张策略与全球市场进入,# 403 - 跨境电商独立站国际化扩张策略与全球市场进入 | ## 1. 核心概念 | ## 2. 市场进入模式 | ### 2.1 直接销售模式 | ### 2.2 第三方平台模式 | ### 2.3 混合模式 | ## 3. 市场评估维度 | ### 3.1 市场容量,403,跨境电商独立站国际化扩张策略与全球市场进入.md,正式主题笔记,是,2026-05-04
415-跨境电商独立站会员体系与私域流量运营策略.md,415 - 跨境电商独立站会员体系与私域流量运营策略,# 415 - 跨境电商独立站会员体系与私域流量运营策略 | ## 学习内容摘要 | ### 1. 会员体系设计 | ### 2. 私域流量运营 | ### 3. 运营策略 | ## 正确性判断 | ## 是否新知识 | ## 理解难度,415,跨境电商独立站会员体系与私域流量运营策略.md,正式主题笔记,是,2026-05-04
417-跨境电商独立站营销策略与26种营销Tactics总结.md,417-跨境电商独立站营销策略与26种营销Tactics总结,# 417-跨境电商独立站营销策略与26种营销Tactics总结 | ## 学习内容摘要 | ### 核心概念 | ### 26种营销Tactics | ### ROI最高的三种策略 | ## 学习判断 | ## 知识关系,417,跨境电商独立站营销策略与26种营销Tactics总结.md,正式主题笔记,是,2026-05-05
418-跨境电商欺诈防护与安全运营策略.md,跨境电商独立站欺诈防护与安全运营策略,# 跨境电商独立站欺诈防护与安全运营策略 | ## 核心要点 | ### 7种主要电商欺诈类型 | ### 防护策略 | ### 数据参考 | ## 实践建议,418,跨境电商欺诈防护与安全运营策略.md,正式主题笔记,否,2026-05-05
419-跨境电商站外促销与Deal网站推广策略.md,419-跨境电商站外促销与Deal网站推广策略,# 419-跨境电商站外促销与Deal网站推广策略 | ## 📌 学习内容摘要 | ### 什么是站外促销（Off-site Promotion）？ | ### 主流Deal网站平台 | ### Deal网站发帖技巧 | ### Facebook群组促销 | ### 效果衡量指标 | ### 风险与注意事项,419,跨境电商站外促销与Deal网站推广策略.md,正式主题笔记,是,2026-05-05
420-跨境电商独立站物流与配送策略/学习.md,420-跨境电商独立站物流与配送策略,# 420-跨境电商独立站物流与配送策略 | ## 核心内容 | ### 1. 物流方式选择 | ### 2. 仓库策略 | ### 3. 配送成本优化 | ### 4. 物流追踪 | ### 5. 主流物流服务商 | ### 6. 退换货处理,420,跨境电商独立站物流与配送策略,正式主题笔记,是,2026-05-25
